"HYMN TITLE","Text","ELH#","TLH#","LW#","LBW#","CW#","HS'98#"
"Now, My Tongue, the Mystery Telling","1 Cor 11:23-26",,,,,,852
"O Bless the Lord My Soul","Ps 108:1-7",60,27,457,,238,
"O Bless the Lord My Soul",,369,,,,,
"O Blessed Day When First was Poured","Gal 4:4-5",157,115,,,,
"O Blessed Holy Trinity","Ps 5:3",80,541,479,,584,
"O Blessed Home Where Man and Wife","Ps 128",189,624,,,,
"O Blessed Sun Whose Splendor",,531,,,,,
"O Blest the House Whate'er Befall","Luke 2:41-52",190,625,467,512,506,
"O Bread of Life From Heaven",,266,,,222,,
"O Bride of Christ Rejoice","Luke 19:28-40",104,57,20,,134,
"O Chief of Cities Bethlehem","Matt 2:1-2, 10-11",,,76,81,,
"O Christ Our Hope Our Heart's Desire","1 Pet 2:24",397,,151,300,,
"O Christ Our King Creator Lord",,,,,101,,
"O Christ Our Light O Radiance True","Luke 1:79",198,512,314,380,569,
"O Christ Our True and Only Light","Luke 1:79",198,512,314,380,569,
"O Christ the Healer We Have Come",,,,,360,,
"O Christ You Are the Light and Day","John 8:12",571,559,,273,,
"O Christ, Thou Lamb of God","John 1:29",,147,,103,,
"O Christ, Who Art the Light and Day","John 8:12",571,559,,273,,
"O Christians Haste",,,,,,570,
"O Come All Ye Faithful","Luke 2:15",133,102,41,45,55,
"O Come O Come Emmanuel","Is 59:20",110,62,31,34,23,
"O Darkest Woe","Acts 3:15",332,167,122,,137,
"O Day Full of Grace That Now We See","Acts 2:1-4",401,,163,161,,
"O Day of Rest and Gladness","Ps 118:24",485,9,203,251,,
"O Dearest Jesus What Law Hast Thou Broken","Luke 23:20-24",292,143,119,123,117,
"O Dearest Lord Thy Sacred Head",,,,,,118,
"O Enter Lord Thy Temple","Acts 2:17",400,228,,,,
"O Faithful God Thanks Be to Thee","Ps 6:1",522,321,,,,
"O Father All Creating","Ps 127:1",,621,251,,,
"O Father May Thy Word Prevail",,215,,,,,
"O for a Faith that Will Not Shrink","Luke 17:5",364,396,,,405,
"O Fount of Good for All Your Love","Ps 116:12",,,395,,524,
"O Gladsome Light O Grace","John 1:9",572,101,486,,,
"O God Be with Us ","Ps 121:3",,556,,,,
"O God Empower Us to Stem",,,,,422,,
"O God Forsake Me Not","Ps 38:21-22",,,372,,424,
"O God Forsake Me Not","Ps 38:22",,402,,,,
"O God From God O God From Light","Ps 43:3",170,132,83,536,85,
"O God I Love Thee Not That My Poor Love",,,,,491,,
"O God My Faithful God","1 Kings 3:5",470,395,371,504,459,
"O God O Lord of Heaven and Earth","Matt 10:8",,443,319,396,400,
"O God of Earth and Altar",,,,,428,,
"O God of Every Nation",,,,,416,,
"O God of God O Light of Light","Ps 43:3",170,132,83,536,85,
"O God of Jacob by Whose Hand","Gen 28:20-22",,434,,477,,
"O God of Light","Ps 119:105",,,,,,869
"O God of Light Your Word a Lamp Unfailing",,,,,237,,
"O God of Light's Great Mystery",,,,,201,,
"O God of Love O King of Peace","Ps 25:7",,,498,414,519,
"O God of Mercy God of Light","Luke 10:36, 37",170,439,397,425,499,
"O God of Mercy God of Might","Luke 10:36, 37",458,439,397,425,499,
"O God of Youth Whose Spirit in Our Hearts is Stirring",,,,,510,,
"O God Our Help in Ages Past","Ps 90",160,123,180,320,441,
"O God Our Lord Thy Holy Word","Rev 14:6, 7",549,266,341,,204,
"O God Our Lord Your Holy Word","Rev 14:6, 7",549,266,341,,204,
"O God Send Heralds Who Will Never Falter",,,,,283,,
"O God Thou Faithful God","1 Kings 3:5",470,395,371,504,459,
"O God Whose Will is Life and Good","Ps 146:8",,,396,,,
"O God Your Hand the Heavens Made",,,,,,481,
"O Happy Day When We Shall Stand",,590,,,351,,
"O Happy Home Where Thou art Loved Most Dearly","Gen 18:19",,626,,,,
"O Holy Blessed Trinity","Ps 5:3",80,541,479,,584,
"O Holy Ghost Thou Gift Divine",,26,,,,,
"O Holy Spirit Enter In","Is 11:2",27,235,160,459,184,
"O Holy Spirit Grant Us Grace","Ps 19:7",25,293,336,,185,
"O How Blest Are Ye Whose Toils Are Ended ","Rev 14:13",526,589,268,,554,
"O How Great Is Thy Compassion","2 Cor 9:15",460,384,364,,,
"O How Holy is This Place",,28,,,,,
"O How Shall I Receive Thee",,94,,,,,
"O Jesus at Your Altar Now",,324,,,,,
"O Jesus Blessed Lord My Praise","2 Cor 9:15",325,309,245,220,316,
"O Jesus Blessed Lord to Thee","2 Cor 9:15",325,309,245,220,316,
"O Jesus Blessed Lord to You","2 Cor 9:15",325,309,245,220,316,
"O Jesus Christ All Praise to Thee",,136,,,,,
"O Jesus Christ May Grateful Hymns be Rising",,,,,427,,
"O Jesus Christ Thy Manger Is","Luke 2:7",161,81,,,40,814
"O Jesus Christ Your Manger Is","Luke 2:7",161,81,,,40,
"O Jesus Christ, true Lamb of God","John 1:29",,,,,,"p.13"
"O Jesus I Have Promised",,,,,503,,
"O Jesus Joy of Loving Hearts",,,,,356,,
"O Jesus King Most Wonderful","1 Pet 2:7",278,361,274,537,373,
"O Jesus King of Glory","Matt 2:1-12",,130,79,,94,
"O Jesus Lamb of God Thou Art","John 1:29",271,328,,,27,
"O Jesus Lamb of God You Are","John 1:29",271,328,,,27,
"O Jesus Lord of Heavenly Grace",,487,,,,,
"O Jesus So Sweet O Jesus So Mild","Gal 4:4-5",,,,,366,858
"O Kingly Love that Faithfully","Matt 22:1-14",,,346,,335,
"O Light of Gentile Nations","Luke 2:32",151,138,,,78,
"O Light of God's Most Wondrous Love",,399,,,,,
"O Light whose splendor",,,,,,,"p.18"
"O Little Flock Fear Not the Foe","Luke 12:32",375,263,300,361,,
"O Little Town of Bethlehem","Micah 5:2",,,59,,66,
"O Little Town of Bethlehem","Micah 5:2",137,647,60,41,65,
"O Living Bread from Heaven","Matt 26:26-29",326,316,244,197,314,
"O Lord How Shall I Meet Thee","Matt 21:1-9",,58,19,23,"18 & 19",
"O Lord How Shall I Meet You","Matt 21:1-9",,58,19,23,"18 & 19",
"O Lord I Sing with Lips and Heart","Ps 92:1",,569,,,,
"O Lord in Prayer You Spent the Night","Luke 6:12ff",505,493,,,548,
"O Lord Look Down from Heaven Behold","Ps 12",440,260,,,205,
"O Lord My God I Cry to Thee","Ps 116:9",573,600,,,,
"O Lord Now Let Your Servant","Luke 2:29-32",,,,339,,"p.14"
"O Lord of Heaven and Earth and Sea","Matt 10:8",,443,319,,487,
"O Lord of Hosts, Whose Glory Fills","Is 60:13",,633,,,,
"O Lord of Light Who Made the Stars","Ps 30:10-12",,,17,323,31,
"O Lord Our Father shall We be Confounded ","Ps 22:5",213,269,,,,
"O Lord Our Father Thanks and Praise","Ps 107:1",,124,,,72,
"O Lord Our Father Thanks to Thee","Ps 107:1",,124,,,72,
"O Lord Our God Your Gracious Hand",,,,,,511,
"O Lord Send Forth Your Spirit",,,,,392,,
"O Lord Throughout These Forty Days","Matt 4:1-11",,,92,99,,
"O Lord We Praise Thee","Ps 118:1",327,313,238,215,317,
"O Lord We Praise Thee Bless Thee and Adore Thee","Ps 118:1",327,313,238,215,317,
"O Lord We Praise You Bless You and Adore You","Ps 118:1",327,313,238,215,317,
"O Lord We Welcome Thee","Is 9:6",,93,,,,
"O Lord Who in Thy Love Divine",,505,,,,,
"O Lord Whose Bounteous Hand Again","Ps 65:9",,567,,,,
"O Lord You Have in Your Pure Grace",,,,,,407,
"O Lord, Hear My Prayer","Ps 31:2",,,,,,891
"O Love Divine How Sweet Thou Art",,62,,,,,
"O Love How Deep How Broad How High","Eph 3:17-21",281,,275,88,371,
"O Love that Casts Out Fear",,,,,,604,
"O Love that Will Not Let Me Go",,,,,324,,
"O Love Who Madest Me to Wear","1 John 4:16",,397,,,,
"O Master Let Me Walk With You",,,,,492,,
"O Master of the Loving Heart",,,,,,491,
"O Morning Star How Fair and Bright","Rev 22:16",,,73,76,,
"O One With God the Father",,,,,77,,
"O Paschal Feast What Joy is Thine",,342,,,,,
"O People Rise and Labor","Luke 3:4, 5",,75,25,,14,
"O Perfect Life of Love!","John 19:30",,170,,,,
"O Perfect Love","Ruth 1:17",,623,253,287,600,
"O Perfect Love All Human Thought Transcending","Ruth 1:17",,623,253,287,600,
"O Rejoice Ye Christians Loudly","2 Cor 8:9",163,96,40,,45,
"O Sacred Head Now Wounded","Is 50:6",334,172,113,116,105,
"O Sacred Head Now Wounded","Is 50:6",335,172,113,117,105,
"O Savior of Our Fallen Race","John 1:1-5",,,45,49,,
"O Savior Precious Savior","1 Pet 1:8",,352,282,514,368,
"O Savior Rend the Heavens Wide","Is 64:1",97,,32,38,22,
"O Sing Jubilee to the Lord Every Land","Ps 100",56,44,205,256,252,
"O Sing with Exultation","Ps 118:15, 16",365,217,,,,
"O Sinner Come Thy Sin to Mourn",,272,,,,,
"O Son of God in Galilee","Mark 7:32-37",,,400,426,,
"O Son of God We Wait for Thee",,536,,,,,
"O Sons and Daughters of the King","John 20",366,208,130,139,165,
"O Spirit of Life O Spirit of God",,,,,,186,
"O Spirit of the Living God","Acts 2:3",,504,,388,,
"O Splendor of God's Glory Bright","John 8:12",81,550,481,271,586,
"O Splendor of the Father's Light","John 8:12",81,550,481,271,586,
"O That I Had a Thousand Voices ","Ps 148:1",443,,448,560,242,
"O That I Had a Thousand Voices ","Ps 148:1",,243,,,194,
"O That the Lord Would Guide My Ways","Ps 119:5, 33",441,416,392,480,462,
"O Thou from Whom All Goodness Flows","Neh 13:31",,515,,,,
"O Thou Love Unbounded","John 16:27",,42,,,,
"O Thou that Hear'st when Sinners Cry","Ps 51",500,325,,,,
"O Thou Who Hast of Thy Pure Grace",,,,,442,,
"O Thou Who Once in Galilee","Mark 7:32-37",,,400,426,,
"O Thou Whose Feet have Climbed Life's Hill","1 Cor 16:13",,486,,,,
"O Trinity Most Blessed Light","Ps 16:9",574,564,487,275,591,
"O Trinity O Blessed Light","Ps 16:9",574,564,487,275,591,
"O Trinity, O Trinity","2 Cor 4:6-7",,,,,,836
"O Watch and Pray",,516,,,,,
"O What Precious Balm and Healing","1 Pet 2:24",293,144,95,,121,
"O Wondrous Type O Vision Fair","Matt 2:1-11",223,,87,80,96,
"O Word of God Incarnate","Ps 119:105",171,294,335,231,279,
"O Zion Haste Your Mission High Fulfilling",,,,,397,,
"O'er Jerusalem Thou Weepest","Luke 19:41",,419,390,,,
"O'er the Distant Mountains Breaking","Matt 24:42",,606,,,220,
"O'er the Gloomy Hills of Darkness","Rev 14:6",,505,,,,
"Of my Life the Life O Jesus",,336,,,,,
"Of the Father's Love Begotten","1 Tim 3:16",181,98,36,42,35,
"Of the Glorious Body Telling",,,,,120,,
"Of Zion's Honor Angels Sing",,216,,,,,
"Oh Bless the Lord My Soul","Ps 108:1-7",60,27,457,,238,
"Oh Blessed Home Where Man and Wife","Ps 128",,,466,,503,
"Oh Blest the House Whate'er Befall","Luke 2:41-52",190,625,467,512,506,
"Oh Come All Ye Faithful","Luke 2:15",133,102,41,45,55,
"Oh Come My Soul",,,,,,99,
"Oh Come Oh Come Emmanuel","Is 59:20",110,62,31,34,23,
"Oh Darkest Woe","Acts 3:15",332,167,122,,137,
"Oh Enter Lord Thy Temple","Acts 2:17",400,228,,,,
"Oh for a Faith that Will Not Shrink","Luke 17:5",364,396,,,405,
"Oh for a Thousand Tongues to Sing","Acts 4:12",,360,276,559,340,
"Oh Gladsome Light of the Father Immortal",,,,,279,,
"Oh Happy Day When We Shall Stand",,590,,,351,,
"Oh How Blest Are They","Rev 14:13",526,589,268,,554,
"Oh How Blest Are Ye Whose Toils Are Ended ","Rev 14:13",526,589,268,,554,
"Oh How Blest Are You Whose Toils Are Ended","Rev 14:13",526,589,268,,554,
"Oh How Great Is Thy Compassion","2 Cor 9:15",460,384,364,,,
"Oh How Great Is Your Compassion","2 Cor 9:15",460,384,364,,,
"Oh Love How Deep How Broad How High","Eph 3:17-21",281,,275,88,371,
"Oh Perfect Life of Love",,,,,,138,
"Oh Praise the Lord My Soul",,,,,538,,
"Oh Rejoice All Christians Loudly","2 Cor 8:9",163,96,40,,45,
"Oh Rejoice Ye Christians Loudly","2 Cor 8:9",163,96,40,,45,
"Oh Sing My Soul Your Maker's Praise",,,,,319,425,
"Oh Sing to the Lord","Ps 100",56,44,205,256,252,
"Oh Sing with Exultation","Ps 118:15, 16",365,217,,,,
"Oh That I Had a Thousand Voices ","Ps 148:1",443,,448,560,242,
"Oh That I Had a Thousand Voices ","Ps 148:1",,243,,,194,
"Oh That the Lord Would Guide My Ways","Ps 119:5, 33",441,416,392,480,462,
"Oh What Their Joy and Their Glory Must Be","Rev 7:10-17",,,,337,,838
"Oh Wondrous Type Oh Vision Fair","Matt 2:1-11",223,,87,80,96,
"Oh Worship the King","Ps 104",,17,458,548,243,
"Oh, Sing to the Lord","Ps 98:1",,,,,,900
"On Christmas Night All Christians Sing","Luke 2:10-14, 20",,,65,,52,
"On Christ's Ascension I Now Build","John 14:3",392,216,150,,173,
"On Eagles' Wings","Ps 91",,,,,440,
"On Galilee's High Mountain","Matt 28:16-20",195,,320,,557,
"On Jordan's Bank the Baptist's Cry","Is 40:3",106,63,14,36,16,
"On Jordan's Bank the Baptist's Cry","Matt 3:3",106,63,14,36,16,
"On Jordan's Bank the Herald's Cry","Matt 3:3",106,63,14,36,16,
"On Mary Virgin Undefiled",,268,,,,,
"On My Heart Imprint Thine Image","Luke 23:38",593,179,100,102,"319 &320",
"On My Heart Imprint Thine Image - Choir","Luke 23:38",598,,,,,
"On My Heart Imprint Your Image","Luke 23:38",593,179,100,102,"319 &320",
"On Our Way Rejoicing",,,,,260,,
"On This Day Earth Shall Ring","Luke 2:1-20",,,,,,809
"On What has Now been Sown","1 Cor. 3:6",594,46,217,261,322,
"Once Again My Heart Rejoices","Luke 2:11",115,77,39,46,37,
"Once He Came in Blessing","Luke 4:18",141,74,30,312,17,
"Once In Royal David's City","Luke 2:4-7",139,,58,,50,
"One There Is Above All Others",,,,,298,,
"One Thing Needful","Luke 10:42",182,366,277,,290,
"One Thing's Needful Lord This Treasure","Luke 10:42",182,366,277,,290,
"One Thy Light, the Temple Filling","Is 6:8",,641,,,,
"Only Begotten Word of God Eternal","Ps 20:1-5",,,323,375,,
"Onward Christian Soldiers","Matt 16:18",,658,518,509,537,
"Open Now Thy Gates of Beauty","Ps 100:4",29,1,198,250,255,
"Open Now Thy Gates of Beauty","Ps 100:4",30,,,,,
"Our Blessed Savior Seven Times Spoke","Heb 5:7",337,177,108,,,
"Our Children Jesus Calls","Mark 10:14",,302,228,,296,
"Our Father By Whose Name","1 Cor 13:14",187,,465,357,501,
"Our Father Thou in Heaven Above","Matt 6:9-13",383,458,431,,410,
"Our Father Throned in Heaven Above",,384,,,,,
"Our Father Who From Heaven Above","Matt 6:9-13",,,430,,,
"Our Father Who From Heaven Above","Matt 6:9-13",383,458,431,,410,
"Our Fathers' God in Years Long Gone","Ps 44",,,326,,535,
"Our God Our Help in Ages Past","Ps 90",160,123,180,320,441,
"Our Heavenly Father Hear","Luke 2-4",,455,,,,
"Our Lord and God O Bless This Day","Is 54:10",514,337,,,599,
"Our Lord and God Oh Bless This Day","Is 54:10",514,337,,,599,
"Our Paschal Lamb, That Sets Us Free","1 Cor 5:7-8",,,,,,830
"Our Table Now with Food is Spread",,601,,,,,
"Out of the Deep I Call","Ps 130",453,327,,,,
"Out of the Depths I Cry to You","Ps 130",452,329,230,295,305,
"Over Kedron Jesus Treadeth",,295,,,,,
"Peace to Soothe Our Bitter Woes",,595,,,338,,
"Pour Out Thy Spirit from on High","Ps 132:9",,490,,,,
"Praise and Thanks and Adoration","Ps 106:1",596,401,387,470,470,
"Praise and Thanksgiving","Ps 107:31-38",,,403,409,,
"Praise Be to the Lord",,,,,,276,
"Praise God from Whom All Blessings Flow","Ps 150:1",592,644,461,564,334,
"Praise God from Whom All Blessings Flow","Ps 150:1",592,644,461,565,334,
"Praise God from Whom All Blessings Flow","Ps 150:1",,,,529,,
"Praise God the Lord Ye Sons of Men","Luke 2:1-14",148,105,44,47,41,
"Praise God This Hour of Sorrow",,475,,,,,
"Praise My Soul the King of Heaven","Ps 103",67,,,549,,893
"Praise Oh Praise Our God and King","Ps 136",,570,,,,
"Praise the Almighty My Soul Adore Him","Ps 146",497,26,445,539,235,
"Praise the Lord O Heavens Adore Him",,64,,,540,,
"Praise the Lord of Heaven",,,,,541,,
"Praise the Lord Rise Up Rejoicing",,,,,196,,
"Praise the Lord Ye Heavens Adore Him",,64,,,540,,
"Praise the One Who Breaks the Darkness","Luke 4:16-21",,,,,353,881
"Praise the Savior Now and Ever",,,,,155,,
"Praise to God Immortal Praise","Hab 3:17, 18",,572,496,,612,
"Praise to the Father for His Lovingkindness",,,,,517,,
"Praise to the Father the Glorious King of Creation",,7,,,,,
"Praise to the Lord the Almighty","Neh 9:6",65,39,444,543,234,
"Praise to Thee and Adoration","Ps 106:1",596,401,387,470,470,
"Praise to You and Adoration","Ps 106:1",596,401,387,470,470,
"Praise We the Lord This Day","Matt 1:23",,274,,,,
"Praise and Thanksgiving Be to God Our Maker",,,,,191,,
"Prayer Is the Soul's Sincere Desire","Luke 11:1",387,454,,,,
"Preach You the Word and Plant It Home","Luke 8:4-15",,,259,,544,
"Precious Lord Take My Hand",,,,,,451,
"Prepare the Royal Highway","Matt 21:8-9",,,27,26,,
"Prepare the Way","Luke 3:4, 5",,,,,,807
"Preserve Thy Word O Savior","Jude 20, 21",533,264,337,,289,
"Preserve Your Word O Savior","Jude 20, 21",533,264,337,,289,
"Redeemed, Restored, Forgiven","Luke 15:24",,32,,,388,
"Rejoice Angelic Choirs Rejoice",,,,,146,,
"Rejoice My Heart Be Glad and Sing","Ps 56:8",,535,424,,443,
"Rejoice O Pilgrim Throng","Ps 118:25-26",,,455,553,540,
"Rejoice Rejoice Believers","Matt 25:6",543,72,,25,7,801
"Rejoice Rejoice This Happy Morn","Luke 2:11",142,79,520,43,,
"Rejoice Rejoice Ye Christians",,132,,,,,
"Rejoice the Lord is King","Rev 19:6",376,,179,171,,
"Renew Me O Eternal Light","2 Cor 3:18",,398,373,511,471,
"Return O Wanderer Return","Luke 15:18",,280,,,,
"Ride On Ride On in Majesty","Matt 21:9",,,105,121,132,
"Ride On Ride On in Majesty","Matt 21:9",280,162,,,133,
"Rise Again Ye Lion-Hearted","Rev 2:10",555,470,,,,
"Rise Arise",,,,,,30,
"Rise Children of the Kingdom",,105,,,,,
"Rise Crowned with Light Imperial Salem, Rise","Is 60:1ff",,503,313,,,
"Rise My Soul to Watch and Pray","Matt 26:41",253,446,302,443,472,
"Rise O Children of Salvation",,,,,182,,
"Rise O Light of Gentile Nations","Is 60:1",199,498,,,577,
"Rise Shine You People Christ the Lord Has Entered","Eph 5:14",,,,393,556,871
"Rise Thou Light of Gentile Nations","Is 60:1",199,498,,,577,
"Rise To Arms With Prayer Employ You","Eph 6:10-18",518,444,303,,455,
"Rise Up O Saints of God",,,,,383,,
"Rise Ye Children of Salvation","Jude 3",217,472,,,,
"Rock of Ages Cleft for Me ","1 Cor 10:4",286,376,361,327,389,
"Round Me Falls the Night","Ps 141:2",,562,,,,
"Round the Lord in Glory Seated",,408,,,,,
"Safely Through Another Week","Ps 65:4",,11,,,,
"Saints Behold the Sight is Glorious",,,,,,216,
"Saints of God, the Dawn is Brightening","John 4:35",,502,,,578,
"Saints, See the Cloud of Witnesses","Heb 11:32",,,,,,840
"Salvation Unto Us Has Come","Rom 3-5",227,377,355,297,390,
"Savior Again to Thy Dear Name We Raise","Ps 110:2",597,47,221,262,321,
"Savior Again to Your Dear Name We Raise","Ps 110:2",597,47,221,262,321,
"Savior Breathe an Evening Blessing","Ps 91:5",,565,,,,
"Savior I Follow On","Ex 15:23",,422,,,473,
"Savior Like a Shepherd Lead Us",,,,,481,,
"Savior of the Nations, Come","John 1:14",,95,13,28,2,
"Savior Sprinkle Many Nations","Is 54:2",,510,,,,
"Savior Thy Dying Love","Acts 9:6",,403,374,,488,
"Savior When in Dust to Thee","Luke 18:13",296,166,93,91,124,
"Savior When in Dust to You","Luke 18:13",296,166,93,91,124,
"Savior Who Thy Flock art Feeding","John 10:11",,631,,,,
"See in Yonder Manger Low","Luke 2:1-20",,,,,58,808
"See the Conqueror Mounts in Triumph","Ps 68:18",,218,,,174,
"See This Wonder in the Making","Matt 3:16-17",,,,,300,842
"Seek Where Ye May to Find a Way","Acts 4:12",207,383,358,,395,
"Seek Where You May to Find a Way","Acts 4:12",207,383,358,,395,
"Send Now O Lord to Every Place","Rom 8:37",,506,316,,572,
"Send O Lord Thy Holy Spirit","Acts 11:24",507,491,263,,545,
"Send O Lord Your Holy Spirit","Acts 11:24",507,491,263,,545,
"Send Thou O Lord to Every Place","Rom 8:37",,506,316,,572,
"Sent Forth By God's Blessing","Luke 24:47-53",,,247,221,318,
"Shepherd of Tender Youth","Is 40:11",183,628,471,,515,
"Silent Night Holy Night","Luke 2:8",140,646,68,65,60,
"Sing a New Song to the Lord",,,,,,245,
"Sing My Tongue How Glorious Battle","Is 52:9-10",298,,117,118,122,
"Sing My Tongue the Glorious Battle","Is 52:9-10",298,,117,118,122,
"Sing Praise to God the Highest Good","Ps 96:1-8",,,452,542,,
"Sing Praise to the God of Israel","Luke 1:68-79",46,,,,,908
"Sing to the Lord of Harvest","Ps 67:5-6",464,,493,412,614,
"Sing with All the Saints in Glory","Rev 7:9-17",,,,,,839
"So Rest My Rest",,338,,,,,
"So Truly As I Live God Saith",,417,,,,,
"Soldiers of Christ Arise","Eph 6:10-18",,450,,,,
"Soldiers of the Cross Arise","Eph 6:17",520,501,,,,
"Son of God Eternal Savior","1 Pet 1:20-23",,,394,364,492,
"Songs of Praise the Angels Sang","Job 38:7",,35,447,,222,
"Songs of Thankfulness and Praise","1 Pet 1:30",172,134,88,90,82,
"Soul Adorn Thyself with Gladness","Rev 19:8",328,305,239,224,311,
"Soul Adorn Yourself with Gladness","Rev 19:8",328,305,239,224,311,
"Soul What Return Has God Thy Savior","Mark 12:17",,404,,,,
"Speak O Lord Thy Servant Heareth","1 Sam 3:10",230,296,339,,283,
"Speak O Lord Your Servant Listens","1 Sam 3:10",230,296,339,,283,
"Speak O Savior I am Listening","1 Sam 3:10",230,296,339,,283,
"Spirit of God Descend Upon My Heart",,,,,486,,
"Spirit of God Sent from Heaven Abroad",,,,,285,,
"Spirit of God Unleashed On Earth",,,,,387,,
"Splendor and Honor","Rev 4:11",,,,,,910
"Spread Oh Spread Almighty Word","Rom 10:15",201,507,321,379,576,
"Spread Oh Spread the Mighty Word","Rom 10:15",201,507,321,379,576,
"Spread Oh Spread Thou Mighty Word","Rom 10:15",201,507,321,379,576,
"Spread the Reign of God the Lord","Rom 10:15",201,507,321,379,576,
"Stand Up Stand Up for Jesus","Luke 12:8",,451,305,389,474,
"Stars of the Morning So Gloriously Bright","Job 38:7",548,255,190,,,
"Strengthen for Service Lord the Hands",,,,,218,,
"Stricken Smitten and Afflicted","Is 53:3-5",297,153,116,,127,
"Sun of My Soul O Savior Dear","Luke 24:29",577,551,488,,,
"Sun of My Soul Thou Savior Dear","Luke 24:29",577,551,488,,,
"Surely It Is God Who Saves Me","Is 12:2-6",,,,,,870
"Sweet Flowerest of the Martyr Band","Rev 14:4",,273,188,,,
"Sweet Is the Work My God My King",,469,,,,,
"Sweet the Moments Rich in Blessing","1 John 1:7",300,155,,,111,
"Swell the Anthem Raise the Song","Deut 8:10-12",,584,,,,
"Take My Life and Let It Be","Eph 6:24",444,400,404,406,469,
"Take My Life O Lord Renew","Eph 6:24",444,400,404,406,469,
"Take My Life That I May Be","Eph 6:24",444,400,404,406,469,
"Take the World but Give Me Jesus",,,,,,355,
"Take Up Your Cross the Savior Said","Matt 16:24",,,382,398,,
"Tell Out, My Soul, the Greatness of the Lord","Luke 1:46-55",,,,,,909
"Ten Thousand Times Ten Thousand","Rev 7:17",557,476,,,,
"Tender Shepherd Thou has Stilled","Matt 18:2",,595,269,,,
"That Day of Wrath That Dreadful Day","2 Pet 3:10",,612,,,,
"That Easter Day with Joy Was Bright","Matt 28:1-7",,,147,154,,
"That Man a Godly Life Might Live","Ex 20:1-17",490,287,331,,285,
"The Advent of Our God","Zech 9:9",99,68,12,22,1,
"The Advent of Our King","Zech 9:9",99,68,12,22,1,
"The Ancient Law Departs","Luke 2:21",158,117,,,,
"The Angel Gabriel from Heaven Came","Luke 1:26-38",,,,,24,805
"The Bells of Christmas Chime Once More",,,,,62,,
"The Bridegroom Soon Will Call Us","Matt 25:6",100,67,176,,10,
"The Church of Christ in Every Age",,,,,433,,
"The Church's One Foundation","Eph 2:20",486,473,289,369,538,
"The Clouds of Judgment Gather","Rev 21:24",534,605,463,322,,
"The Day Full of Grace",,,,,,254,
"The Day Is Past and Over","Ps 13:3",,555,,,,
"The Day is Surely Drawing Near","Luke 21:25-36",538,611,462,321,207,
"The Day of Resurrection","Ps 118:15",356,205,133,141,166,
"The Day You Gave Us Lord has Ended",,,,,274,594,
"The Day You Gave Us Lord is Ended","Rom 13:11-12",,,,274,594,904
"The Death of Jesus Christ Our Lord","Matt 26:26-29",329,163,107,,135,
"The First Day of the Week",,,,,246,,
"The First Noel the Angel Did Say",,,,,56,,
"The God of Abraham Praise","Ex 3:6",69,40,450,544,,
"The Gospel Shows the Father's Grace","John 3:16",233,297,330,,288,
"The Happy Christmas Comes Once More",,143,,,,,
"The Head that Once was Crowned with Thorns","Heb 2:10",393,219,,173,217,
"The Hills are Bare at Bethlehem",,,,,61,,
"The Infant Priest Was Holy Borne","Heb 9:11-28",,,,,,853
"The King of Glory Comes",,,,,,363,
"The King of Love My Shepherd Is","Ps 23",370,431,412,456,375,
"The King Shall Come When Morning Dawns","Rev 22:20",101,,26,33,25,
"The Kingdom Satan Founded",,259,,,,,
"The Lamb","Rev 5:12-13",,,,,,822
"The Law Commands and Makes Us Know","Ps 19:9",489,289,,,286,
"The Law of God Is Good and Wise","Ps 19:8",492,295,329,,287,
"The Litany",,,661,,,,
"The Lord Hath Helped Me Hitherto","1 Sam 7:12",71,33,456,,,
"The Lord Into His Father's Hands",,339,,,,,
"The Lord is God There Is No Other",,,,,,292,
"The Lord My Faithful Shepherd Is",,368,,,,,
"The Lord My God be Praised","Deut 22:3",404,38,174,,,
"The Lord My God Be Praised","Ps 92:1-4",404,,174,,,
"The Lord My Pasture Shall Prepare","Ps 23",,368,,,,
"The Lord My Shepherd Is","Ps 23",,426,,,,
"The Lord Will Come and Not be Slow",,,,,318,,
"The Lord's My Shepherd I'll Not Want","Ps 23",371,436,416,451,360,
"The Lord's My Shepherd Leading Me","Ps 23",,,417,,,
"The Man Is Ever Blest","Ps 1",,414,388,,475,
"The Morning Light is Breaking","Matt 28:19, 20",,497,,,,
"The Morning Sun is Brightly Beaming","1 John 1:7",,545,,,,
"The Mystery Hidden from the Eyes",,405,,,,,
"The New Church Year Again Is Come",,93,,,,,
"The Night Will Soon Be Ending","Rom 13:12a",,,,,,806
"The Old Year Now Has Passed Away","John 15:4",,125,,,71,
"The Old Year Now Hath Passed Away","John 15:4",,125,,,71,
"The Only Son from Heaven","John 6:38-39",224,,72,86,86,
"The People That in Darkness Sat","Is 9:2",153,106,77,,90,
"The People That in Darkness Sat","Matt 4:16",153,106,77,,90,
"The Power of Sin No Longer",,243,,,,,
"The Radiant Sun Shines in the Skies","Ps 91: 9-16",78,547,,,,
"The Royal Banners Forward Go","Ps 96:10",273,168,103,124,,
"The Royal Banners Forward Go","Ps 96:10",273,168,104,125,,
"The Saints on Earth and Those Above","Heb 12:22-24",,478,,,,
"The Savior Calls Let Every Ear","Matt 11:28",,281,350,,,
"The Savior Kindly Calls","Mark 10:14",,302,228,,296,
"The Son of God Goes Forth to War","1 Tim 6:12",559,452,304,183,,
"The Son of God Our Christ the Word the Way",,,,,434,525,
"The Star Proclaims the King is Here","Matt 2:9",173,131,81,,91,
"The Stars Declare His Glory",,,,,,246,
"The Strife is O'er the Battle Done","Ps 98:1",357,210,143,135,148,
"The Sun Arises Now","Ps 145:15",83,542,,,,
"The Sun Has Gone Down",,575,,,,,
"The Sun's Last Beam of Light is Gone","Ps 91:11, 12",562,562,,,,
"The Temple Rang with Golden Coins","Mark 12:41-44",,,,,,885
"The Ten Commandments Are the Law","Ex 20:1-17",490,287,331,,285,
"The Tree of Life with Every Good","Gen 3:1-15",302,,,,,873
"The Voice that Breathed o'er Eden","Eccl 4:12",,622,,,,
"The Will of God Is Always Best","Matt 6:10",477,517,425,,435,
"The World Is Very Evil","Rev 21:24",534,605,463,322,,
"Thee God We Praise Thy Name We Bless",,44,,,,,
"Thee We Adore Eternal Lord",,,,,547,,
"Thee We Adore O Hidden Savior Thee","Matt 26:26-28",,,,199,,849
"Thee Will I Love My Strength My Tower","John 14:23",409,399,375,502,476,
