dayname,Deitrich Collect,Series 3 Lesson,Title,Color,Series 2 Lesson,Old Testament,Series 2 Gospel,Collect,Theme,Psalm,Epistle,Gospel,Series 3 Gospel
Easter 3,"Lord God, heavenly Father, out of Your fatherly goodness You have been mindful of us poor, miserable sinners, and have given Your beloved Son to be our Shepherd, not only to nourish us by His Word, but also to defend us from sin, death, and the devil: We beseech You, grant us Your Holy Spirit, that, even as this Shepherd knows us and helps us in every affliction, we also may know Him, and, trusting in Him, seek help and comfort in Him, from our hearts obey His voice, and obtain eternal salvation; through the same, Your beloved Son, Jesus Christ, our Lord, who lives and reigns with You and the Holy Spirit, one true God, now and forever. Amen",Heb 13:20-21,Third Sunday of Easter: Misericordia,White,1 Pet 5:1-4,Ezek 34:11-16,John 21:15-25,"O God, by the humiliation of Your Son You raised up the fallen world: Grant to Your faithful people perpetual gladness, and those whom You have delivered from the danger of everlasting death, make partakers of eternal joys; through the same Jesus Christ, Your Son, our Lord, who lives and reigns with You and the Holy Spirit, one true God, now and forever. Amen. ","Jesus, our Good Shepherd",33,1 Pet 2:21-25,John 10:11-16,John 10:1-10
Easter 6,"Lord God, heavenly Father, through Your Son You have promised us that whatever we ask in His name You will give us: We beseech You, keep us in Your Word, and grant us Your Holy Spirit, that He may govern us according to Your will; protect us from the power of the devil, from false doctrine and worship; and also defend our lives against all danger. Grant us Your blessing and peace, that we may in all things perceive Your merciful help, and both now and forever praise and glorify You as our gracious Father; through our Lord Jesus Christ, Your Son, who lives and reigns with You and the Holy Spirit, one true God, now and forever. Amen. ",Jam 5:16-20,Sixth Sunday of Easter: Rogate,White,Heb 7:18-25,Jer 29:11-14,John 17:18-23,"O God, from whom all good things do come: Grant to us, Your humble servants, that by Your holy inspiration we may think those things that are right, and by Your merciful guiding may perform the same: through Jesus Christ, Your Son, our Lord, who lives and reigns with You and the Holy Spirit, one true God, now and forever. Amen. ",Prayer,124,James 1:22-27,John 16:23-30,Matt 6:5-13
Easter 7,"Lord God, heavenly Father, we give thanks to You, that through Your Holy Spirit You have appointed us to bear witness of Your dear Son, our Lord Jesus Christ: We beseech You, inasmuch as the world cannot endure such testimony and persecutes us in every way, grant us courage and comfort, that we may not be offended because of the cross, but continue steadfastly in Your testimony, and be always found among those who know You and Your Son, until we obtain eternal salvation through the same, Your Son, Jesus Christ our Lord, who lives and reigns with You and the Holy Spirit, one true God, now and forever. Amen.",1 Pet 3:15-17,Seventh Sunday of Easter: Exaudi,White,Acts 1:12-14,Ezek 36:25-27,Luke 11:5-13,"Almighty, everlasting God, grant us always to have a devout will towards You, and the desire to serve Your majesty with a pure heart; through Jesus Christ, Your Son, our Lord, who lives and reigns with You and the Holy Spirit, one true God, now and forever. Amen. ",The Promised Comforter,27,1 Pet 4:7-11,John 15:26-16:4,Luke 12:4-12
Easter 4,"Lord God, heavenly Father, of Your fatherly goodness You allow Your children to come under Your chastening rod here on earth, that we might be like Your only-begotten Son in suffering and hereafter in glory: We beseech You, comfort us by Your Holy Spirit in all temptations and afflictions, that we may not fall into despair, but that we may continually trust in Your Son's promise, that our trials will endure but a little while, and will then be followed by eternal joy; that we thus, in patient hope, may overcome all evil, and at last obtain eternal salvation; through the same, Your Son, Jesus Christ our Lord, who lives and reigns with You and the Holy Spirit, one true God, now and forever. Amen. ",1 Pet 1:3-9,Fourth Sunday of Easter: Jubilate,White,Heb 4:14-16,Lam 3:18-26,John 17:1-8,"Almighty God, You show those who are in error the light of Your truth, to the intent that they may return into the way of righteousness: Grant that all who are admitted into the fellowship of Christ's kingdom, may avoid those things that are contrary to their profession, and follow all such things as are agreeable to the same; through our Lord Jesus Christ, who lives and reigns with You and the Holy Spirit, one true God, now and forever. Amen. ",The New Creation: A Little While,66,1 Pet 2:11-20,John 16:16-23,John 14:1-12
Reformation Day,"Lord God, heavenly Father, we most heartily thank You that by Your Word You have brought us out of the darkness of error into the light of Your grace: We beseech You, mercifully help us to walk in that light, guard us from all error and false doctrine, and grant that we may not become ungrateful and despise and persecute Your Word, but receive it with all our heart, govern our lives according to it, and put all our trust in Your grace, through the merit of Your dear Son, our Lord Jesus Christ, who lives and reigns with You and the Holy Spirit, one true God, now and forever. Amen. ",Reformation Day,Red,2 Chr 29:12-19,"O Lord God, heavenly Father: Pour out, we beseech You, Your Holy Spirit on Your faithful people; keep them steadfast in Your grace and truth, protect and comfort them in all temptation, defend them against all enemies of Your Word, and bestow upon Christ's Church militant Your saving peace; through the same, Jesus Christ, Your Son, our Lord, who lives and reigns with You and the Holy Spirit, one true God, now and forever. Amen. ","Reformation, Saints' Days",46,Rev 14:6-7,Matt 11:12-15
