dayname,Deitrich Collect,Series 3 Lesson,Title,Color,Series 2 Lesson,Old Testament,Series 2 Gospel,Collect,Theme,Psalm,Epistle,Gospel,Series 3 Gospel
2nd Last Sunday,"O almighty, eternal and merciful God, by Your beloved Son, our Lord and Savior Jesus Christ, You established the kingdom of grace for us in Your holy Church here on earth, that we might believe the forgiveness of our sins, since You are a God who has no pleasure in the death of the wicked, but that the wicked turn from his way and live: We beseech You, graciously forgive us all our sins; through the same, Your Son, Jesus Christ, who lives and reigns with You and the Holy Spirit, one true God, now and forever. Amen.",Heb 4:9-13,2nd-Last Sunday of the Church Year,Green,1 Cor 15:22-28,Isa 40:9-11,Matt 11:25-30,"O God, so rule and govern our hearts and minds by Your Holy Spirit, that, being ever mindful of the end of all things and the day of Your last judgment, we may be stirred up to holiness of living here and dwell with You forever hereafter; through Jesus Christ, Your Son, our Lord, who lives and reigns with You and the Holy Spirit, one true God, now and forever. Amen. ",Last Judgment,50,2 Thes 1:3-10,Matt 25:31-46,John 5:22-29
PhilipJames,,,Sts. Philip and James the Apostles,White,,,,,,,Eph. 2:19-20,John 14:1-14,
Baptism of Jesus,"Lord God, heavenly Father, You manifested Yourself, with the Holy Spirit, in the fullness of grace at the baptism of Your dear Son, and with Your voice directed us to Him who has borne our sins, that we might receive grace and the remission of sins: Keep us, we beseech You, in the true faith; and inasmuch as we have been baptized in accordance with Your command, and the example of Your dear Son, we pray You to strengthen our faith by Your Holy Spirit, and lead us to everlasting life and salvation; through Your beloved Son, Jesus Christ, our Lord, who lives and reigns with You and the Holy Spirit, one true God, now and forever. Amen. ",Isa 53:1-7,"Baptism of Our Lord, Jesus",Green,Eph 5:25-27,Isa 42:1-9,Luke 18:31-43,"Father in heaven, as at the baptism in the Jordan river You once proclaimed Jesus Your beloved Son and anointed Him with the Holy Spirit, grant that all who are baptized in His name may faithfully keep the covenant into which they have been called, boldly confess their Savior, and with Him be heirs of life eternal; through Jesus Christ, Your Son, our Lord, who lives and reigns with You and the Holy Spirit, one true God, now and forever. Amen. ","Baptism of Our Lord, Jesus",89,1 Pet 3:18-22,Matt 3:13-17,John 1:29-34
Pentecost: second,,Whit-Monday,Red,Isa 32:14-20,,,19,Acts 2:42-47,John 4:5-26
Stephen,,,St. Stephen the Martyr,Red,,,,"Grant, O Lord, that in all our sufferings here upon earth for the testimony of Your truth we may steadfastly look up to heaven and by faith behold the glory that shall be revealed; and, being filled with the Holy Spirit, may learn to love and bless our persecutors by the example of Your first martyr, Saint Stephen, who prayed for his murderers to You, O blessed Jesus, who stands at the right hand of God to help all those who suffer for You, our only Mediator and advocate; who lives and reigns with Father and the Holy Spirit, one true God, now and forever. Amen. ",Suffering for Christ,,Acts 6:8-15; 7:54-60,Matt. 23:34-39,
Trinity,"O Lord God, heavenly Father: We poor sinners confess that in our flesh dwells no good thing, and that, left to ourselves, we die and perish in sin, since that which is born of flesh is flesh and cannot see the kingdom of God. But we pray that You would grant us Your grace and mercy, and for the sake of Your Son, Jesus Christ, send Your Holy Spirit into our hearts, that being regenerate we may firmly believe the forgiveness of sins according to Your promise in baptism, and that we may daily increase in Christian love and in other good works, until we at last obtain eternal salvation; through the same Your beloved Son Jesus Christ, our Lord, who lives and reigns with You and the Holy Spirit, one true God, now and forever. Amen.",Titus 3:3-7,Festival of Holy Trinity,White,1 John 3:1-10,Eze 18:30-32,John 15:12-17,"Almighty God, by Your grace alone we are called into Your kingdom, to confess the true faith, to acknowledge the glory of the eternal Trinity, and in the power of the divine majesty to worship the true Unity: We beseech You, that You would keep us steadfast in this faith, and evermore defend us from all adversities; for You, O Father, Son, and Holy Spirit, live and reign, one true God, now and forever. Amen. ",Born of the Spirit,8,Rom 11:33-36,John 3:1-15,Matt 28:16-20
New Year's Eve,,New Year's Eve,White,Isa 63:7-18,"Almighty and everlasting God, from whom comes down every good and perfect gift: We give You thanks for all Your benefits, temporal and spiritual, bestowed upon us in the year past, and we beseech You of Your goodness, grant us a favorable and joyful year, defend us from all dangers and adversities, and send upon us the fullness of Your blessing; through Jesus Christ, Your Son, our Lord, who lives and reigns with You and the Holy Spirit, one true God, now and forever. Amen. ",New Year,90,1 Pet 1:22-25,Luke 13:6-10
Thanksgiving
Magdalene,,,St. Mary Magdalene,White,,Prov. 31:10-31,,,,,,Luke 7:36-50,
PeterPaul,,,Sts. Peter and Paul the Apostles,White,,,,,,,Acts 12:1-11,Matt. 16:13-20,
Thomas,,,St. Thomas the Apostle,White,,,,"Almighty and ever-living God, who through the Word of Your Son did mightily strengthen the faith of Your Apostle Saint Thomas: by the same Word keep us ever steadfast in the faith unto our end; through Jesus Christ, Your dear Son, our Lord, who lives and reigns with You and the Holy Spirit, one true God, now and forever. Amen. ",Strenthening of Faith,,Eph. 1:3-6,John 19:24-31,
Matthias,,,St. Matthias the Apostle,White,,,,,,,Acts 1:15-26,Matt. 11:25-30,
Sexagesima,"Lord God, heavenly Father, we thank You that through Your Son Jesus Christ You have sown Your holy Word among us: We pray that You will prepare our hearts by Your Holy Spirit, that we may diligently and reverently hear Your Word, keep it in good hearts, and bring forth fruit with patience; and that we may not incline to sin, but subdue it by Your power, and in all persecutions comfort ourselves with Your grace and continual help; through Your beloved Son, Jesus Christ, our Lord, who lives and reigns with You and the Holy Spirit, one true God, now and forever. Amen. ",2 Tim 3:14-4:5,Sexagesima Sunday,Green,1 Cor 1:20-25,Isa 55:10-13,John 12:35-43,"O God, You see that we do not put our trust in anything we do: Mercifully grant, that by Your power we may be defended against all adversity; through Jesus Christ, Your Son, our Lord, who lives and reigns with You and the Holy Spirit, one true God, now and forever. Amen. ",Word of God: Sower and the Seed,44,2 Co 11:19-12:9,Luke 8:4-15,Matt 9:37-10:7
Paul,,,The Conversion of St. Paul,White,,,,,,,Acts 9:1-22,Matt. 19:27-30,
Mark,,,St. Mark the Evangelist,White,,,,,,,Eph. 4:7-16,Luke 10:1-9,
Matthew,,,St. Matthew the Apostle,White,,,,,,,Eph. 4:7-14,Matt. 9:9-13,
All Saints Day,"O almighty and everlasting God, through Your only-begotten and beloved Son, Jesus Christ, You will sanctify all Your elect and beloved: Give us grace to follow their faith, hope, and love, that we together with them may obtain eternal life; through Your Son, Jesus Christ, our Lord, who lives and reigns with You and the Holy Spirit, one true God, now and forever. Amen. ",Rev 22:1-7,All Saints' Day,White,Rev 7:13-17,Isa 25:6-9,Matt 5:13-16,"O almighty God, You have knit together Your elect in one communion and fellowship in the mystical body of Your Son, Christ our Lord: Grant us grace to follow Your blessed saints in all virtuous and godly living, that we may come to those unspeakable joys which You have prepared for those who truly love You; through Jesus Christ, Your Son, our Lord, who lives and reigns with You and the Holy Spirit, one true God, now and forever. Amen. ",Saints and Martyrs,33,Rev 7:2-12,Matt 5:1-12,Luke 6:20-26
Good Friday,"Almighty and everlasting God, You willed that Your Son should bear for us the pains of the cross, that You might remove from us the power of the adversary: Help us to remember and give thanks for our Lord's Passion that we may obtain remission of sin and redemption from everlasting death; through the same, our Lord Jesus Christ. Amen. ",Good Friday,Black,Isa 52:13-53:12,"Almighty God, we pray that You would graciously behold this Your family, for which our Lord Jesus Christ was content to be betrayed into the hands of wicked men and to suffer death upon the cross; through the same, Jesus Christ, Your Son, our Lord, who lives and reigns with You and the Holy Spirit, one true God, now and forever. Amen. ",Jesus' Atoning Death,22,Heb 10:1-25,John 18:1-19:42
Quinquagesima,,Quinquagesima Sunday,Green,1 Pet 3:18-22,Isa 35:3-7,John 12:23-36,"O Lord, we beseech You, mercifully hear our prayers, and having set us free from the bonds of sin, defend us from all evil; through Jesus Christ, Your Son, our Lord, who lives and reigns with You and the Holy Spirit, one true God, now and forever. Amen. ",Up to Jerusalem,31,1 Cor 13:1-13,Luke 18:31-43
Whit-Tuesday,,Whit-Tuesday,Red,,
Ash Wednesday,,Ash Wednesday,Black or Purple,1 John 1:5-9,Joel 2:12-19,Luke 6:20-49,"Almighty and everlasting God, You hate nothing that You have made and You forgive the sins of all those who are penitent; create and make in us new and contrite hearts, that we, worthily lamenting our sins and acknowledging our wretchedness, may obtain of You, the God of all mercy, perfect remission and forgiveness; through Jesus Christ, Your Son, who lives and reigns with You and the Holy Spirit, one true God, now and forever. Amen. ",Penitence and Repentance,51,2 Cor 5:20-6:10,Matt 6:16-21
Trinity 18,"Lord God, heavenly Father: We are poor, miserable sinners; we know Your will, but cannot fulfill it because of the weakness of our flesh and blood, and because our enemy, the devil, will not leave us in peace. Therefore we beseech You, shed Your Holy Spirit in our hearts, that in steadfast faith we may cling to Your Son Jesus Christ, find comfort in His Passion and death, believe the forgiveness of sins through Him, and in willing obedience to Your will lead holy lives on earth, until by Your grace, through a blessed death, we depart from this world of sorrow, and obtain eternal life; through Your Son, Jesus Christ our Lord, who lives and reigns with You and the Holy Spirit, one true God, now and forever. Amen. ",1 John 2:7-17,Eighteenth Sunday after Trinity,Green,Rom 10:1-13,Deut 10:12-21,John 10:23-38,"O Lord, because without You we are not able to please You: Mercifully grant that Your Holy Spirit may in all things direct and rule our hearts; through Jesus Christ, Your Son, our Lord, who lives and reigns with You and the Holy Spirit, one true God, now and forever. Amen. ",Law and Gospel: The Great Commandment,"(117, 122)",1 Cor 1:4-9,Matt 22:34-46,Mark 10:17-27
Trinity 19,"O mighty and everlasting God, by Your Son Jesus Christ You mercifully helped the paralytic both in body and soul: We beseech You, for the sake of Your great mercy, be gracious also to us; forgive us all our sins, and so govern us by Your Holy Spirit, that we may not ourselves be the cause of sickness and other afflictions; keep us in Your fear, and strengthen us by Your grace that we may escape temporal and eternal wrath and punishment; through Your Son, Jesus Christ, our Lord, who lives and reigns with You and the Holy Spirit, one true God, now and forever. Amen. ",Col 3:1-10,Ninteenth Sunday after Trinity,Green,Rom 10:14-21,Isa 44:21-23,John 9:1-11,"O almighty and most merciful God, of Your bountiful goodness keep us, we beseech You, from all things that may hurt us, that we, being ready in both body and soul, may cheerfully accomplish those things You would have us do; through Jesus Christ, Your Son, our Lord, who lives and reigns with You and the Holy Spirit, one true God, now and forever. Amen. ",Absolution: Jesus Forgives the Paralytic,"(35, 78)",Eph 4:22-28,Matt 9:1-8,Luke 13:10-17
Trinity 12,"Almighty and everlasting God, who created all things, we thank You that You have given us sound bodies, and have graciously preserved our tongues and other members from the power of the adversary: We beseech You, grant us Your grace, that we may rightly use our ears and tongues; help us to hear Your Word diligently and devoutly, and with our tongues so to praise and glorify Your grace, that no one is offended by our words, but that all may be edified by them; through Your beloved Son, Jesus Christ, our Lord, who lives and reigns with You and the Holy Spirit, one true God, now and forever. Amen. ",1 Cor 2:9-16,Twelveth Sunday after Trinity,Green,Rom 7:1-6,Isa 29:18-19,Matt 12:33-37,"Almighty and everlasting God, only by Your gift it comes that Your faithful people perform true and praiseworthy service: Grant, we beseech You, that we may faithfully serve You in this life, and fail not finally to attain Your heavenly promises; through Jesus Christ, Your Son, our Lord, who lives and reigns with You and the Holy Spirit, one true God, now and forever. Amen.",Jesus Heals the Sick,70,2 Cor 3:4-11,Mark 7:31-37,John 9:24-38
Trinity 13,"Lord God, heavenly Father, we most heartily thank You that You have granted us to live in this accepted time, when we may hear Your holy Gospel, know Your fatherly will, and behold Your Son, Jesus Christ! We pray, most merciful Father: Let the light of Your holy Word remain with us, and so govern our hearts by Your Holy Spirit, that we may never forsake Your Word, but remain steadfast in it, and finally obtain eternal salvation; through Your beloved Son, Jesus Christ, our Lord, who lives and reigns with You and the Holy Spirit, one true God, now and forever. Amen. ",1 Cor 13:1-13,Thirteenth Sunday after Trinity,Green,Rom 7:7-25,Lev 18:1-5,Matt 5:43-48,"Almighty and everlasting God, You have made us heirs of Your eternal and great promises: Increase in us daily the gifts of faith, hope, and love, that we may love all that You command; through Jesus Christ, Your Son, our Lord, who lives and reigns with You and the Holy Spirit, one true God, now and forever. Amen. ",Charity: The Good Samaritan,74,Gal 3:15-22,Luke 10:23-37,John 13:34-35
Trinity 10,"Almighty and everlasting God, by Your Holy Spirit You have revealed to us the Gospel of Your Son, Jesus Christ: We beseech You so to enliven our hearts that we may sincerely receive Your Word, and not make light of it, or hear it without fruit, as did Your people, the unbelieving Jews, but that we may fear You and daily grow in faith in Your mercy, and finally obtain eternal salvation; through Your Son, Jesus Christ, our Lord, who lives and reigns with You and the Holy Spirit, one true God, now and forever. Amen. ",Heb 3:12-4:1,Tenth Sunday after Trinity,Green,Rom 5:12-21,Jer 7:1-7,Matt 11:16-24,"O God, You declare Your almighty power chiefly in showing mercy and pity: Mercifully grant that we, who by Your grace in Christ have been made partakers of Your heavenly treasure, may cheerfully serve You also in this life, running the way of Your commandments; through Jesus Christ, Your Son, our Lord, who lives and reigns with You and the Holy Spirit, one true God, now and forever. Amen.",Renewed Obedience: Jesus Cleanses the Templ,55,1 Cor 12:1-11,Luke 19:41-48,John 6:66-71
Trinity 11,"Lord God, heavenly Father, we beseech You so to guide and direct us by Your Holy Spirit, that we may not forget our sins and be filled with pride, but continue in daily repentance and renewal, seeking comfort only in the blessed knowledge that You will be merciful to us, forgive us our sins, and grant us eternal life; through Your beloved Son, Jesus Christ, our Lord, who lives and reigns with You and the Holy Spirit, one true God, now and forever. Amen. ",1 John 1:8-2:2,Eleventh Sunday after Trinity,Green,Rom 6:1-23,2 Sam 22:21-29,Matt 21:28-31,"Almighty and everlasting God, You are always more ready to hear than we are to pray, and to give more than we either desire or deserve: Pour down upon us the abundance of Your mercy, forgiving us those things of which our conscience is afraid, and giving us those good things which we are not worthy to ask, but through the merits and mediation of Jesus Christ, Your Son, our Lord, who lives and reigns with You and the Holy Spirit, one true God, now and forever. Amen. ",Humility: The Pharisee and the Tax-Collecto,68,1 Cor 15:1-10,Luke 18:9-14,Matt 23:1-12
Trinity 16,"Lord God, heavenly Father, You sent Your Son to be made flesh, that by His death He might atone for our sins and deliver us from eternal death: We pray, confirm in our hearts the hope that our Lord Jesus Christ, who with but a word raised the widow's son, in like manner will raise us on the last day and grant us eternal life; through Your beloved Son, Jesus Christ, our Lord, who lives and reigns with You and the Holy Spirit, one true God, now and forever. Amen. ",Phil 1:20-26,Sixteenth Sunday after Trinity,Green,Rom 9:1-13,Deut 32:39-40,John 11:19-29,"Lord, we pray that Your grace may always go before and follow after us, that we may be continually given to all good works; through Jesus Christ, Your Son, our Lord, who lives and reigns with You and the Holy Spirit, one true God, now and forever. Amen. ",Death and Burial:Young Man of Nain,"(102, 115)",Eph 3:13-21,Luke 7:11-17,John 11:32-45
Trinity 17,"Lord God, heavenly Father: We beseech You so to guide and direct us by Your Holy Spirit that we may not exalt ourselves, but humbly fear You, with our whole hearts hear and keep Your Word, and keep the day of rest holy, that we also may be sanctified by Your Word; help us, first, to place our hope and confidence in Your Son, Jesus Christ, who alone is our righteousness and Redeemer, and, then, so to amend and better our lives in accordance with Your Word, that we may avoid all offenses and finally obtain eternal salvation; through Your grace in Christ, who lives and reigns with You and the Holy Spirit, one true God, now and forever. Amen. ",Gal 5:1-14,Seventeenth Sunday after Trinity,Green,Rom 9:14-23,1 Sam 2:1-10,Mark 2:18-28,"Lord, we beseech You, grant Your people strength to withstand the temptations of the devil, and with pure hearts and minds to follow You, the only God; through Jesus Christ, Your Son, our Lord, who lives and reigns with You and the Holy Spirit, one true God, now and forever. Amen. ",Christian Freedom: Healing on the Sabbath,119:124-128,Eph 4:1-6,Luke 14:1-11,Matt 18:1-7
Trinity 14,"Lord God, heavenly Father, by Your blessed Word and Your holy Baptism You have mercifully cleansed all who believe from the fearful leprosy of sin, and daily grant us Your gracious help in all our need: We beseech You so to enlighten our hearts by Your Holy Spirit, that we may never forget these Your blessings, but ever live in Your fear, and, trusting fully in Your grace, with thankful hearts continually praise and glorify You; through Your Son, our Lord Jesus Christ, who lives and reigns with You and the Holy Spirit, one true God, now and forever. Amen. ",Rev 3:1-6,Fourteenth Sunday after Trinity,Green,Rom 8:1-17,Jer 17:13-14,John 5:1-14,"Keep Your Church, we beseech You, O Lord, with Your perpetual mercy; and because our weak flesh without You can only fail, keep us ever by Your help from all things hurtful, and lead us to all things profitable to our salvation; through Jesus Christ, Your Son, our Lord, who lives and reigns with You and the Holy Spirit, one true God, now and forever. Amen. ",Thanksgiving: The Ten Lepers,"(92, 65)",Gal 5:16-24,Luke 17:11-19,Luke 4:23-30
Trinity 15,"Lord God, heavenly Father, we thank You for all Your benefits. that You have given us life and graciously sustained us to this day: We beseech You, do not take Your blessing from us; preserve us from covetousness, that we may serve You only, love and abide in You, and not defile ourselves by idolatrous love of wealth, but hope and trust only in Your grace; through Jesus Christ our Lord, who lives and reigns with You and the Holy Spirit, one true God, now and forever. Amen. ",Cor 7:29-31,Fifteenth Sunday after Trinity,Green,Rom 8:18-39,Deut 6:4-7,Luke 10:38-42,"O Lord, we beseech You, let Your continual mercy cleanse and defend Your Church; and because it cannot continue in safety without Your help, preserve it evermore by Your help and goodness; through Jesus Christ, Your Son, our Lord, who lives and reigns with You and the Holy Spirit, one true God, now and forever. Amen. ",Contentment: Lilies of the Field,"(86, 108)",Gal 5:25-6:10,Matt 6:24-34,Matt 6:19-23
Trinity 8,"Lord God, heavenly Father, we most heartily thank You that You have caused us to come to the knowledge of Your Word. We pray: Graciously keep us steadfast in this knowledge unto death, that we may obtain eternal life; send us, now and ever, pious pastors who faithfully preach Your Word, without offense or false doctrine, and grant them long life. Defend us from all false teachings, and frustrate the counsels of all who pervert Your Word, who come to us in sheep's clothing, but inwardly are ravenous wolves, that Your true Church may evermore be established among us, and be defended and preserved from such false teachers; through our Lord Jesus Christ, Your Son, who lives and reigns with You and the Holy Spirit, one true God, now and forever. Amen.",1 John 4:1-6,Eighth Sunday after Trinity,Green,Rom 4:9-25,Jer 15:19-21,Matt 7:12-14,"Grant to us, Lord, we beseech You, the spirit to think and do always such things as are right, that we, who cannot do anything that is good without You, may by You be enabled to live according to Your will; through Jesus Christ, Your Son, our Lord, who lives and reigns with You and the Holy Spirit, one true God, now and forever. Amen. ",Beware of False Prophets,48,Rom 8:12-17,Matt 7:15-23,Mark 7:5-16
Trinity 9,"Lord God, heavenly Father, You have bountifully given us Your blessing and our daily bread: We beseech You, preserve us from covetousness, and so enliven our hearts that we willingly share Your blessed gifts with our needy brethren; that we may be found faithful stewards of Your gifts, and abide in Your grace when we shall be removed from our stewardship, and shall come before Your judgment, through our Lord Jesus Christ, who lives and reigns with You and the Holy Spirit, one true God, now and forever. Amen. ",2 Thes 3:10-13,Ninth Sunday after Trinity,Green,Rom 5:1-11,1 Chr 29:10-13,Luke 12:42-48,"Let Your merciful ears, O Lord, be open to the prayers of Your humble servants; and, that they may obtain their petitions, make them to ask such things as are pleasing to You; through Jesus Christ, Your Son, our Lord, who lives and reigns with You and the Holy Spirit, one true God, now and forever. Amen. ",Stewardship: The Wise Steward,54,1 Cor 10:6-13,Luke 16:1-9,Luke 16:10-17
Trinity 1,"Lord God, heavenly Father, we beseech You so to rule and govern our hearts by Your Holy Spirit, that we may not, like the rich man, hear Your Word in vain, and become so devoted to things temporal that we forget things eternal; but that we readily and according to our ability serve those who are in need, and not defile ourselves with carousing and pride; in trial and misfortune keep us from despair, and grant us to put our trust wholly in Your fatherly help and grace, so that in faith and Christian patience we may overcome all things; through Your Son, Jesus Christ our Lord, who lives and reigns with You and the Holy Spirit, one true God, now and forever. Amen. ",1 Tim 6:6-16,First Sunday after Trinity,Green,Rom 1:1-17,Jer 9:23-24,Luke 12:13-21,"O God, the Strength of all who put their trust in You: Mercifully accept our prayers; and because through the weakness of our mortal nature we can do nothing good without You, grant us Your Holy Spirit, that we may please You both in will and deed; through Jesus Christ, Your Son, our Lord, who lives and reigns with You and the Holy Spirit, one true God, now and forever. Amen. ",Apostles and Prophets: Rich Man and Lazarus,13,1 John 4:16-21,Luke 16:19-31,Matt 16:24-27
Trinity 2,"Lord God, heavenly Father, we give thanks to You, that through Your holy Word You have called us to Your great supper, and we beseech You: Enliven our hearts by Your Holy Spirit, that we may not hear Your Word without fruit, but that we may prepare ourselves rightly for Your kingdom, and not allow ourselves to be hindered by any worldly care; through Your beloved Son Jesus Christ, our Lord, who lives and reigns with You and the Holy Spirit, one true God, now and forever. Amen. ",2 Pet 1:1-11,Second Sunday after Trinity,Green,Rom 1:18-25,Isa 25:6-9,Luke 14:25-35,"O Lord, You never fail to help and govern those whom You bring up in Your steadfast fear and love: Make us ever revere and adore Your holy name; through Jesus Christ, Your Son, our Lord, who lives and reigns with You and the Holy Spirit, one true God, now and forever. Amen. ",Invitation: The Great Supper,120,1 John 3:13-18,Luke 14:16-24,Luke 9:51-62
